user_input,retrieved_contexts,response,reference,faithfulness,nv_context_relevance,context_recall,context_precision
Did the President suggest any potential for US military involvement in Ukraine?,"['Together with our allies we are providing support to the Ukrainians in their fight for freedom. Military assistance. Economic assistance. Humanitarian assistance. \nWe are giving more than $1 Billion in direct assistance to Ukraine. \nAnd we will continue to aid the Ukrainian people as they defend their country and to help ease their suffering.  \nLet me be clear, our forces are not engaged and will not engage in conflict with Russian forces in Ukraine.', 'Our forces are not going to Europe to fight in Ukraine, but to defend our NATO Allies – in the event that Putin decides to keep moving west.  \nFor that purpose we’ve mobilized American ground forces, air squadrons, and ship deployments to protect NATO countries including Poland, Romania, Latvia, Lithuania, and Estonia. \nAs I have made crystal clear the United States and our Allies will defend every inch of territory of NATO countries with the full force of our collective power.', 'Groups of citizens blocking tanks with their bodies. Everyone from students to retirees teachers turned soldiers defending their homeland. \nIn this struggle as President Zelenskyy said in his speech to the European Parliament “Light will win over darkness.” The Ukrainian Ambassador to the United States is here tonight. \nLet each of us here tonight in this Chamber send an unmistakable signal to Ukraine and to the world.', 'Six days ago, Russia’s Vladimir Putin sought to shake the foundations of the free world thinking he could make it bend to his menacing ways. But he badly miscalculated. \nHe thought he could roll into Ukraine and the world would roll over. Instead he met a wall of strength he never imagined. \nHe met the Ukrainian people. \nFrom President Zelenskyy to every Ukrainian, their fearlessness, their courage, their determination, inspires the world.']","No, the President did not suggest any potential for US military involvement in Ukraine. He made it clear that US forces are not engaged and will not engage in conflict with Russian forces in Ukraine.",Members of Congress and the Cabinet.,1.0,1.0,0.0,0.0
